{
  "schema_version": "crypto-market-generation-provenance/v1",
  "provider": "openrouter",
  "requested_model": "example/model:free",
  "actual_model": "example/model:free",
  "actual_provider": "example-provider",
  "prompt_version": "crypto-market-analysis/v1",
  "analysis_schema_version": "crypto-market-analysis/v1",
  "evidence_schema_version": "crypto-market-evidence-bundle/v1",
  "source_snapshot": {
    "path": "data/crypto/hourly/2026/07/08/1742_AEST_source_snapshot.json",
    "sha256": "8e3a016884ceaac860ae2457e1e35762a039e2a04568230950cb69fd05b5327e"
  },
  "evidence_bundle": {
    "bundle_id": "sha256:d86d7a2ee02a06f2c1d3225019f239a46478e85a7d6c4c531ed9371230689971",
    "sha256": "d86d7a2ee02a06f2c1d3225019f239a46478e85a7d6c4c531ed9371230689971"
  },
  "generated_at": "2026-07-11T04:00:00Z",
  "generation_parameters": {
    "temperature": 0.2,
    "max_output_tokens": 4000
  },
  "usage": {
    "input_tokens": 1200,
    "output_tokens": 450,
    "total_tokens": 1650
  },
  "generation_id": "fixture-generation-001",
  "prompt_sha256": "194713ad972b9125a463802fa203cc68e814e7b681bece09a1975df5efd0fa11",
  "completion_sha256": "c2fe8b94ae210a23b37d29f8d0b354b857aa351dc624db3e866dd016d2a7e9cd",
  "routing": {
    "provider_fallback_used": false,
    "cross_model_fallback_used": false,
    "provider_preferences": [
      "example-provider"
    ]
  },
  "estimated_cost_usd": 0
}
